{
  "schema_version": "9709_math_mark_scheme_v2",
  "paper_code": "9709_s19_61",
  "question_id": "9709_s19_61_q2",
  "question_num": 2,
  "subject_code": "9709",
  "component": "S1",
  "year": 2019,
  "session": "May/June",
  "variant": "61",
  "total_marks": 3,
  "parts": [
    {
      "id": "9709_s19_61_q2",
      "label": "",
      "marks": 3,
      "answer": "$\\frac58\\frac{x}{x+6}=\\frac14$; $x=4$",
      "official_mark_scheme_text": "$P_J(\\text{plum})=5/8$, $P_R(\\text{plum})=x/(x+6)$; multiply their two plum probabilities and equate to $1/4$ [M1]. $\\frac58\\frac{x}{x+6}=\\frac14$ [A1 correct equation oe]. $x=4$ [A1; SC correct answer with no appropriate equation/common sense B1]. Total 3.",
      "structured": {
        "version": 1,
        "sections": [
          {
            "label": "Main method",
            "steps": [
              {
                "working": "$P_J(\\text{plum})=5/8$ and $P_R(\\text{plum})=x/(x+6)$; multiply and equate to $1/4$.",
                "mark": "M1",
                "guidance": "Use their two plum probabilities."
              },
              {
                "working": "$\\frac58\\frac{x}{x+6}=\\frac14$.",
                "mark": "A1",
                "guidance": "Correct equation OE."
              },
              {
                "working": "$x=4$.",
                "mark": "A1",
                "guidance": "Correct solution. Special case: correct answer with no appropriate equation/common sense earns B1 only."
              }
            ]
          }
        ],
        "total": 3
      },
      "criteria": [
        {
          "criterion_id": "9709_s19_61_q2_c01_01",
          "source_section": "Main method",
          "working": "$P_J(\\text{plum})=5/8$ and $P_R(\\text{plum})=x/(x+6)$; multiply and equate to $1/4$.",
          "mark": "M1",
          "guidance": "Use their two plum probabilities.",
          "observable": "$P_J(\\text{plum})=5/8$ and $P_R(\\text{plum})=x/(x+6)$; multiply and equate to $1/4$.",
          "observable_status": "source-preserved"
        },
        {
          "criterion_id": "9709_s19_61_q2_c01_02",
          "source_section": "Main method",
          "working": "$\\frac58\\frac{x}{x+6}=\\frac14$.",
          "mark": "A1",
          "guidance": "Correct equation OE.",
          "observable": "$\\frac58\\frac{x}{x+6}=\\frac14$.",
          "observable_status": "source-preserved"
        },
        {
          "criterion_id": "9709_s19_61_q2_c01_03",
          "source_section": "Main method",
          "working": "$x=4$.",
          "mark": "A1",
          "guidance": "Correct solution. Special case: correct answer with no appropriate equation/common sense earns B1 only.",
          "observable": "$x=4$.",
          "observable_status": "source-preserved"
        }
      ],
      "alternative_routes": [
        {
          "route_id": "9709_s19_61_q2_route_01",
          "label": "Main method",
          "criterion_ids": [
            "9709_s19_61_q2_c01_01",
            "9709_s19_61_q2_c01_02",
            "9709_s19_61_q2_c01_03"
          ]
        }
      ]
    }
  ],
  "source": {
    "kind": "finalised_csv",
    "csv": "S1_All_Topics_Student_Pathway_Finalised.csv",
    "csv_sha256": "f35ba8a7042c352ab4a0caab1dd410885084855486da21edc0a5492d202d8825"
  }
}
